{
  "$schema": "schema.json",
  "protocolVersion": 2,
  "releasedAppVersion": "0.3.6",
  "origin": {
    "privateKeySeedHex": "000102030405060708090a0b0c0d0e0f101112131415161718191a1b1c1d1e1f",
    "publicKeyHex": "8f40c5adb68f25624ae5b214ea767a6ec94d829d3d7b5e1ad1ba6f3e2138285f",
    "canonicalHelloJSON": "{\"appVersion\":\"0.3.6\",\"ephemeralPublicKey\":\"j0DFrbaPJWJK5bIU6nZ6bslNgp09e14a0bpvPiE4KF8=\",\"role\":\"origin\",\"supportedVersions\":[2],\"version\":2}"
  },
  "recipient": {
    "privateKeySeedHex": "202122232425262728292a2b2c2d2e2f303132333435363738393a3b3c3d3e3f",
    "publicKeyHex": "358072d6365880d1aeea329adf9121383851ed21a28e3b75e965d0d2cd166254",
    "canonicalHelloJSON": "{\"appVersion\":\"0.3.6\",\"ephemeralPublicKey\":\"NYBy1jZYgNGu6jKa35EhODhR7SGijjt16WXQ0s0WYlQ=\",\"role\":\"recipient\",\"supportedVersions\":[2],\"version\":2}"
  },
  "commitment": {
    "canonicalProjectionJSON": "{\"ephemeralPublicKey\":\"NYBy1jZYgNGu6jKa35EhODhR7SGijjt16WXQ0s0WYlQ=\",\"role\":\"recipient\",\"version\":2}",
    "helloDigestHex": "f88dc1093b87c5d709997a5bc4ce3efa19bd58fce8ca5fb5d87a769e742c04a2",
    "canonicalJSON": "{\"appVersion\":\"0.3.6\",\"helloDigest\":\"+I3BCTuHxdcJmXpbxM4++hm9WPzoyl+12Hp2nnQsBKI=\",\"role\":\"recipient\",\"supportedVersions\":[2],\"version\":2}"
  },
  "transcriptHex": "0026746573736572612f6e65617262792d626f6f7473747261702f7472616e7363726970742f76320002000b726f6c653a6f726967696e00208f40c5adb68f25624ae5b214ea767a6ec94d829d3d7b5e1ad1ba6f3e2138285f000e726f6c653a726563697069656e740020358072d6365880d1aeea329adf9121383851ed21a28e3b75e965d0d2cd166254",
  "transcriptHashHex": "7e3631b4e7284359ef2dce76be1e393c8cb867cc6c619f432432b9b004818087",
  "sasBytesHex": "c1b8f6cbe80105e4",
  "sasDigits": "027492",
  "directionalMaterial": {
    "originToRecipientKeyHex": "4f84e4ce11a964d0466f6f4a8cd1a0e90236c0527aab7a45ce8846d3bb65a0a7",
    "recipientToOriginKeyHex": "3aec62eef1b1d4b300362f34a3e8418f540c96c5f226a76acbb0b35002ba56ea",
    "originToRecipientNonceHex": "1c1a555c8dcde6f3963c422c",
    "recipientToOriginNonceHex": "c7cc335db51aa0ee95fd8478"
  },
  "fullTransfer": {
    "recipientPublicKeyCanonicalJSON": "{\"algorithm\":\"ssh-ed25519\",\"blob\":\"AAAAC3NzaC1lZDI1NTE5AAAAIAABAgMEBQYHCAkKCwwNDg8QERITFBUWFxgZGhscHR4f\",\"displayName\":\"Recipient key\",\"fingerprint\":\"SHA256:ZkAslGjFiUHdGf/WUL8rQvkib4PTvQatUV0OUQSncCA\",\"id\":\"AAAAAAAA-AAAA-AAAA-AAAA-AAAAAAAAAAAA\",\"protection\":\"software\"}",
    "manifestCanonicalJSON": "{\"appearance\":{\"accent\":\"blue\",\"chromeMaterial\":\"system\",\"colorScheme\":\"system\",\"cursorBlink\":true,\"cursorStyle\":\"block\",\"customAccentRGB\":31487,\"monospacedFontName\":\"SFMono-Regular\",\"terminalFontSize\":14,\"terminalThemeID\":\"default\"},\"hosts\":[{\"address\":\"server.example\",\"authenticationHint\":\"publicKey\",\"id\":\"BBBBBBBB-BBBB-BBBB-BBBB-BBBBBBBBBBBB\",\"launchMode\":\"autoTmux\",\"name\":\"vector-host\",\"osHint\":\"linux\",\"port\":22,\"portForwards\":[],\"sortOrder\":0,\"tags\":[],\"transport\":\"ssh\",\"user\":\"alice\"}],\"identities\":[],\"jumpChains\":[],\"knownHosts\":[],\"settings\":{\"accessoryBarKeys\":[],\"bellNotificationEnabled\":false,\"bellSoundEnabled\":false,\"bellVisualEnabled\":true,\"filesDefaultDestination\":\"cwd\",\"filesReaperDays\":30,\"modifierBehavior\":\"oneShot\",\"scrollbackLines\":10000},\"version\":2}",
    "importAcceptanceCanonicalJSON": "{\"acceptedHostIDs\":[\"BBBBBBBB-BBBB-BBBB-BBBB-BBBBBBBBBBBB\"],\"manifestHash\":\"3k6vWac8kayU1wjFoJfXrfJmczzOwEDOjm7e7EcO3Z0=\"}",
    "grantReceiptCanonicalJSON": "{\"publicKeyFingerprint\":\"SHA256:ZkAslGjFiUHdGf/WUL8rQvkib4PTvQatUV0OUQSncCA\",\"publicKeyID\":\"AAAAAAAA-AAAA-AAAA-AAAA-AAAAAAAAAAAA\",\"results\":[{\"hostID\":\"BBBBBBBB-BBBB-BBBB-BBBB-BBBBBBBBBBBB\",\"hostName\":\"vector-host\",\"status\":\"installed\"}]}",
    "completionAcknowledgementCanonicalJSON": "{\"grantReceiptHash\":\"xv1yxZfr6ae4HuVBQS6sDrCCp7ZNhk3L9AQ5CXWZZ1c=\",\"publicKeyID\":\"AAAAAAAA-AAAA-AAAA-AAAA-AAAAAAAAAAAA\"}",
    "frames": [
      {
        "name": "recipient-public-key",
        "kind": "recipientPublicKey",
        "direction": "recipientToOrigin",
        "directionByte": 2,
        "sequence": 1,
        "frameVersion": 1,
        "frameHex": "5442434801020000000000000001c7cc335db51aa0ee95fd8479a438717b0265141a551676cfe2b8a130fce687cbec5417154deb078057c4ed942ab1bfc7a7cf5313c4784ef31f7b2536e6ea03d6cbc5a87b5de809de70aa6cc5b2edd4c97875e2f33a457e03856a6b0c62c0d90133dcb0af54d379ac57dddf122b232c9827c3de30bd97ec65451e5e93f71ed75f77354466adf81b9094e32cb18d6723a05e0630d2be52e928221da308ce9d821d71192aa0e69467d2debc632f0b55b905bb445d349b6ac7782f7a0106004ab64ee19eb893e5fb0fd2780cf90b92b56c77b8ea0c4755504248bacda0deaa253b5e98f4f1b7fffcfc15bd5644919d718d66b8527d8794e7e2bc5b9471b8746984b0090d6cfbcef0edaa45389d80d3b5fd0e4f964893365aed1ec45f033750c3c905247bdbc7b2400770e010ac5a18335e9dcfa33c1a618c405288b1b81ef2ff6e202aa7c13251dc60f1f6dfd5344a3939a9f39ea7d645e072ccecff5ae99c95490bcc641e6a36ecbb8f2d7d37a9650024dc5c6367798d74552c4099d0aae21d81fa2cbb500da721783b4e6cc6d3a4bda8a4be0e167cd11d6d99ec5c3366d3e834071a172ac6c5390a776ba721d977f7",
        "alternateFrameHex": "5442434801020000000000000001c7cc335db51aa0ee95fd8479a4386a73156d59411346298eeeb1823df0d5b3c8ed55124667c94ecb348fd78f30efb7d299ba3848ef5551e3326f0833ccea2595c8b0d17b5de809e642cd4df3b9c0cbff534cf1cf38414f119e424a07549ec22e32e0bcaf54d379a457f2d71e1f190e9238c1ec03b887ef5940257899e878f52e720b5042b3eb1b9590df24aa8d5923a45f6302a2b534ed2c12668951c9b0994364362595fa9259f7efe46b0a043d8f7eb8221c10b348e67b29511e5c3b7bbd4df2a4dfd3cf8f39cd4407dc37828f076b93ed07426353565bbac2d79eb91861078483ed99d7c5e054bb576e93ae44a779890e4fb994e681c548bb7abc6d6888a4102351b0d4c4c7aa75379ac3d4c1df7b7b9758ea3a49d004dc5f313351b594162013c4dc9f540430ef15b75e040f5eefc8a0232f64e8504291d6cb36f29a6e3d37b1cd005acc1885eee1d534573939a9f39ea7d658e072ccecff59df9c93463ad4596d51058aafa1381b239b566756f7425f6b41be13495e75f8dfa0f12089ba6ca4200a977c4e69167c80df88bd92b7b952381cc04d4789d5441c26d3e8382ce56193fae72b101a00fd8bec0f09"
      },
      {
        "name": "origin-authorization-proof",
        "kind": "originAuthorization",
        "direction": "originToRecipient",
        "directionByte": 1,
        "sequence": 1,
        "frameVersion": 1,
        "frameHex": "54424348010100000000000000011c1a555c8dcde6f3963c422d2b84b6fb8d7228871d40682e49b3c5484d1c123b4eef871d1f00a1be27f345c2d49f7a2e7155353760386153b9dc704febb89d7772e3641d236de4",
        "alternateFrameHex": "54424348010100000000000000011c1a555c8dcde6f3963c422d2b84adf39a7a65dc5b0d20650cf6896251061e7606a4920e020ea7be44aa13dada947f3b71457e622c38612b62110785d9b734631d101edbff7eaf"
      },
      {
        "name": "origin-manifest",
        "kind": "manifest",
        "direction": "originToRecipient",
        "directionByte": 1,
        "sequence": 2,
        "frameVersion": 1,
        "frameHex": "54424348010100000000000000021c1a555c8dcde6f3963c422ea58ce39595393be5802d06ab3b3dcf8ab1003d6b85746ca83173eaa881db87ce42ff4967f41147d0b21264fd7a640e3b73190c08e1decb74b10f1ec4321cb80e893e6f79962c44912cc942e1310bce3eb6a45d7bce2e4fe8ea417cc409cf3e427c72255f26645b8ce307cc58cabdbbdf9b9ca77fbe908f23f1ae89021208e96afd9e9c71ce6777b89ff815df5ff91fffe8625682ede00dbbe8ef4f997647848b9d9609e475da2ba1c9defe403b99ed7ca59a7983f4695a726ff487b0fae2bc3396e95934fb97018da13b55e8a7446db09ce3430f2c7b2ad5f3f6834e4c841c82189a8198749595dabc3c869bbea478123fe78b2a51fd25b149b75f189299fb76667c52abe3038335956b29656a56a250dd74d2c1200d019c2b4401ab2273a991b757aeba945e03a4af6695b22bf6048d0e0e0f134ed6715d5606f959555aa71fd326da2c1b4593d0170fc4c5a81af42a07c9fc1be74a263c742bd44809cb95b7ff77341b91d5c97a6cc40816c0924223e752410798556650fbc7fc8fdfa4aa49a9ad20ee35c2c561eeb1e6460ab87b5eab3d544b2f361d2fc085269eb2069af7492ef8c38571091a5c3c928a8dfab967bab407f4e2c753ece93305a6dd546c9599eb50f6b3f5529352a6a35586a34cb7a2e96530738e39c7c424234227f8dc0fb1ba2c581ab6ba7c49d8ff64c2e646a238971a733f6014d6529818b14748a2795958a352ec60ede45a71da690f3c88fb343638106783a425f544e212b77b4fa221d201a4c4471ad2b9e91103f8c3d0b179326b78d47b0626c9a28a8cedd04990cb3fd41ebfd4dccdb0819ec45b7c5a07579d7132209b12115ea1061c03966b79390f2da0ed9628d107dcad48f13439be3190e7634869bfbeb620b300948754764f606f5f33bbd5513686c7523c012b5b31a4be31ce857ee60c0cf35b6bbf75919366071c770d7849c2aba658501c1611b61b7da1707cbb4e9424819b4702bbaa189b9244e927841f18eee52c29ea54f91e90f2c59c91e035b3758822ef88c877274db79fb1c3261078102e5798440b1c5a276bf96bba03875464c875ead4f624b379101c5363c7ef7f742aa6b555a58f3910b83e3f289ae8bdd84a6ff6c12cdd92fed17f6751c7a2e3c3fa63cbb9db0d1c3b05b84fcc3542b4058456f034d0752300fce812a420ccedd4c7e5f7f0459ff35f1b62bb23d8b77e6124c7c1520822ce642e1dc58b811ac96f3b91cec4cf86432c29012e72ab2c33ebd21e2f707365e864166acd2a5a645d44e94d6223584da09db09f11d3fcfecf2cbe7b47f4d8199c4a2a5c54fc045e9c15089ddc7d5e9151f3b2b872bfe5c4e55a58674c8d288b29fecc00f4fd88689551aca76634f8184ac6a84454a41bc32a12db50a9e45bfe44b6aae0b9e59aebe2b7110d6c55b9bb0c774f0ec33ccddb805907af43381fe0570fe40f357f09a6607ebab7d7aaf22a695ec482065de84d6093110df83f4ec391b00a5bc0193efea497d38bede753a14ed0e14c4f46dcf61473f6de6708dbbd",